smartctl 6.6 2017-11-05 r4594 [x86_64-linux-4.17.10-1-ARCH] (local build)
Copyright (C) 2002-17, Bruce Allen, Christian Franke, www.smartmontools.org

=== START OF INFORMATION SECTION ===
Device Model:     Hitachi HUA5C3030ALA640
Firmware Version: MEAOA800
User Capacity:    3,000,592,982,016 bytes [3.00 TB]
Sector Size:      512 bytes logical/physical
Rotation Rate:    5700 rpm
Form Factor:      3.5 inches
Device is:        Not in smartctl database [for details use: -P showall]
ATA Version is:   ATA8-ACS T13/1699-D revision 4
SATA Version is:  SATA 2.6, 6.0 Gb/s (current: 6.0 Gb/s)
Local Time is:    Sat Jul 28 12:13:25 2018 CEST
SMART support is: Available - device has SMART capability.
SMART support is: Enabled
AAM feature is:   Unavailable
APM feature is:   Disabled
Rd look-ahead is: Enabled
Write cache is:   Disabled
DSN feature is:   Unavailable
ATA Security is:  Disabled, NOT FROZEN [SEC1]
Wt Cache Reorder: Unknown

=== START OF READ SMART DATA SECTION ===
SMART Status not supported: Incomplete response, ATA output registers missing
SMART overall-health self-assessment test result: FAILED!
Drive failure expected in less than 24 hours. SAVE ALL DATA.
Warning: This result is based on an Attribute check.
See vendor-specific Attribute list for failed Attributes.

General SMART Values:
Offline data collection status:  (0x04)	Offline data collection activity
					was suspended by an interrupting command from host.
					Auto Offline Data Collection: Disabled.
Self-test execution status:      (   0)	The previous self-test routine completed
					without error or no self-test has ever
					been run.
Total time to complete Offline
data collection: 		(36068) seconds.
Offline data collection
capabilities: 			 (0x5b) SMART execute Offline immediate.
					Auto Offline data collection on/off support.
					Suspend Offline collection upon new
					command.
					Offline surface scan supported.
					Self-test supported.
					No Conveyance Self-test supported.
					Selective Self-test supported.
SMART capabilities:            (0x0003)	Saves SMART data before entering
					power-saving mode.
					Supports SMART auto save timer.
Error logging capability:        (0x01)	Error logging supported.
					General Purpose Logging supported.
Short self-test routine
recommended polling time: 	 (   1) minutes.
Extended self-test routine
recommended polling time: 	 ( 601) minutes.
SCT capabilities: 	       (0x003d)	SCT Status supported.
					SCT Error Recovery Control supported.
					SCT Feature Control supported.
					SCT Data Table supported.

SMART Attributes Data Structure revision number: 16
Vendor Specific SMART Attributes with Thresholds:
ID# ATTRIBUTE_NAME          FLAGS    VALUE WORST THRESH FAIL RAW_VALUE
  1 Raw_Read_Error_Rate     PO-R--   100   100   016    -    0
  2 Throughput_Performance  P-S---   134   134   054    -    109
  3 Spin_Up_Time            POS---   117   117   024    -    596 (Average 600)
  4 Start_Stop_Count        -O--C-   100   100   000    -    343
  5 Reallocated_Sector_Ct   PO--CK   001   001   005    NOW  2
  7 Seek_Error_Rate         PO-R--   100   100   067    -    0
  8 Seek_Time_Performance   P-S---   124   124   020    -    36
  9 Power_On_Hours          -O--C-   093   093   000    -    49023
 10 Spin_Retry_Count        PO--C-   100   100   060    -    0
 12 Power_Cycle_Count       -O--CK   100   100   000    -    157
192 Power-Off_Retract_Count -O--CK   099   099   000    -    2145
193 Load_Cycle_Count        -O--C-   099   099   000    -    2145
194 Temperature_Celsius     -O----   200   200   000    -    30 (Min/Max 11/70)
196 Reallocated_Event_Count -O--CK   100   100   000    -    2
197 Current_Pending_Sector  -O---K   001   001   000    -    19613
198 Offline_Uncorrectable   ---R--   100   100   000    -    0
199 UDMA_CRC_Error_Count    -O-R--   200   200   000    -    3
                            ||||||_ K auto-keep
                            |||||__ C event count
                            ||||___ R error rate
                            |||____ S speed/performance
                            ||_____ O updated online
                            |______ P prefailure warning

General Purpose Log Directory Version 1
SMART           Log Directory Version 1 [multi-sector log support]
Address    Access  R/W   Size  Description
0x00       GPL,SL  R/O      1  Log Directory
0x01           SL  R/O      1  Summary SMART error log
0x03       GPL     R/O      1  Ext. Comprehensive SMART error log
0x04       GPL     R/O      7  Device Statistics log
0x06           SL  R/O      1  SMART self-test log
0x07       GPL     R/O      1  Extended self-test log
0x08       GPL     R/O      2  Power Conditions log
0x09           SL  R/W      1  Selective self-test log
0x10       GPL     R/O      1  NCQ Command Error log
0x11       GPL     R/O      1  SATA Phy Event Counters log
0x20       GPL     R/O      1  Streaming performance log [OBS-8]
0x21       GPL     R/O      1  Write stream error log
0x22       GPL     R/O      1  Read stream error log
0x80-0x9f  GPL,SL  R/W     16  Host vendor specific log
0xe0       GPL,SL  R/W      1  SCT Command/Status
0xe1       GPL,SL  R/W      1  SCT Data Transfer

SMART Extended Comprehensive Error Log Version: 1 (1 sectors)
Device Error Count: 3340 (device log contains only the most recent 4 errors)
	CR     = Command Register
	FEATR  = Features Register
	COUNT  = Count (was: Sector Count) Register
	LBA_48 = Upper bytes of LBA High/Mid/Low Registers ]  ATA-8
	LH     = LBA High (was: Cylinder High) Register    ]   LBA
	LM     = LBA Mid (was: Cylinder Low) Register      ] Register
	LL     = LBA Low (was: Sector Number) Register     ]
	DV     = Device (was: Device/Head) Register
	DC     = Device Control Register
	ER     = Error register
	ST     = Status register
Powered_Up_Time is measured from power on, and printed as
DDd+hh:mm:SS.sss where DD=days, hh=hours, mm=minutes,
SS=sec, and sss=millisec. It "wraps" after 49.710 days.

Error 3340 [3] occurred at disk power-on lifetime: 48992 hours (2041 days + 8 hours)
  When the command that caused the error occurred, the device was active or idle.

  After command completion occurred, registers were:
  ER -- ST COUNT  LBA_48  LH LM LL DV DC
  -- -- -- == -- == == == -- -- -- -- --
  40 -- 51 00 05 00 00 cd 3d dc 83 0d 00  Error: UNC 5 sectors at LBA = 0xcd3ddc83 = 3443383427

  Commands leading to the command that caused the error were:
  CR FEATR COUNT  LBA_48  LH LM LL DV DC  Powered_Up_Time  Command/Feature_Name
  -- == -- == -- == == == -- -- -- -- --  ---------------  --------------------
  25 00 00 00 08 00 00 cd 3d dc 80 40 00  1d+02:39:29.734  READ DMA EXT
  25 00 00 00 08 00 00 cd 3d dc 78 40 00  1d+02:39:29.733  READ DMA EXT
  25 00 00 00 08 00 00 cd 3d dc 70 40 00  1d+02:39:29.733  READ DMA EXT
  25 00 00 00 08 00 00 cd 3d dc 68 40 00  1d+02:39:29.732  READ DMA EXT
  25 00 00 00 08 00 00 cd 3d dc 60 40 00  1d+02:39:29.732  READ DMA EXT

Error 3339 [2] occurred at disk power-on lifetime: 48992 hours (2041 days + 8 hours)
  When the command that caused the error occurred, the device was active or idle.

  After command completion occurred, registers were:
  ER -- ST COUNT  LBA_48  LH LM LL DV DC
  -- -- -- == -- == == == -- -- -- -- --
  40 -- 51 00 7d 00 00 cd 3d dc 83 0d 00  Error: UNC 125 sectors at LBA = 0xcd3ddc83 = 3443383427

  Commands leading to the command that caused the error were:
  CR FEATR COUNT  LBA_48  LH LM LL DV DC  Powered_Up_Time  Command/Feature_Name
  -- == -- == -- == == == -- -- -- -- --  ---------------  --------------------
  25 00 00 01 00 00 00 cd 3d dc 00 40 00  1d+02:39:26.259  READ DMA EXT
  25 00 00 01 00 00 00 cd 3d db 00 40 00  1d+02:39:26.255  READ DMA EXT
  25 00 00 01 00 00 00 cd 3d da 00 40 00  1d+02:39:26.252  READ DMA EXT
  25 00 00 01 00 00 00 cd 3d d9 00 40 00  1d+02:39:26.249  READ DMA EXT
  25 00 00 01 00 00 00 cd 3d d8 00 40 00  1d+02:39:26.246  READ DMA EXT

Error 3338 [1] occurred at disk power-on lifetime: 48979 hours (2040 days + 19 hours)
  When the command that caused the error occurred, the device was active or idle.

  After command completion occurred, registers were:
  ER -- ST COUNT  LBA_48  LH LM LL DV DC
  -- -- -- == -- == == == -- -- -- -- --
  40 -- 51 00 03 00 00 75 fe 83 dd 05 00  Error: UNC 3 sectors at LBA = 0x75fe83dd = 1979614173

  Commands leading to the command that caused the error were:
  CR FEATR COUNT  LBA_48  LH LM LL DV DC  Powered_Up_Time  Command/Feature_Name
  -- == -- == -- == == == -- -- -- -- --  ---------------  --------------------
  25 00 00 00 08 00 00 75 fe 83 d8 40 00     14:31:15.847  READ DMA EXT
  25 00 00 00 08 00 00 75 fe 83 d8 40 00     14:31:12.292  READ DMA EXT
  25 00 00 00 08 00 00 75 fe 83 d0 40 00     14:31:12.291  READ DMA EXT
  25 00 00 00 08 00 00 75 fe 83 c8 40 00     14:31:12.291  READ DMA EXT
  25 00 00 00 08 00 00 75 fe 83 c0 40 00     14:31:12.291  READ DMA EXT

Error 3337 [0] occurred at disk power-on lifetime: 48979 hours (2040 days + 19 hours)
  When the command that caused the error occurred, the device was active or idle.

  After command completion occurred, registers were:
  ER -- ST COUNT  LBA_48  LH LM LL DV DC
  -- -- -- == -- == == == -- -- -- -- --
  40 -- 51 00 03 00 00 75 fe 83 dd 05 00  Error: UNC 3 sectors at LBA = 0x75fe83dd = 1979614173

  Commands leading to the command that caused the error were:
  CR FEATR COUNT  LBA_48  LH LM LL DV DC  Powered_Up_Time  Command/Feature_Name
  -- == -- == -- == == == -- -- -- -- --  ---------------  --------------------
  25 00 00 00 08 00 00 75 fe 83 d8 40 00     14:31:12.292  READ DMA EXT
  25 00 00 00 08 00 00 75 fe 83 d0 40 00     14:31:12.291  READ DMA EXT
  25 00 00 00 08 00 00 75 fe 83 c8 40 00     14:31:12.291  READ DMA EXT
  25 00 00 00 08 00 00 75 fe 83 c0 40 00     14:31:12.291  READ DMA EXT
  25 00 00 00 08 00 00 75 fe 83 b8 40 00     14:31:12.290  READ DMA EXT

SMART Extended Self-test Log Version: 1 (1 sectors)
No self-tests have been logged.  [To run self-tests, use: smartctl -t]

SMART Selective self-test log data structure revision number 1
 SPAN  MIN_LBA  MAX_LBA  CURRENT_TEST_STATUS
    1        0        0  Not_testing
    2        0        0  Not_testing
    3        0        0  Not_testing
    4        0        0  Not_testing
    5        0        0  Not_testing
Selective self-test flags (0x0):
  After scanning selected spans, do NOT read-scan remainder of disk.
If Selective self-test is pending on power-up, resume after 0 minute delay.

SCT Status Version:                  3
SCT Version (vendor specific):       256 (0x0100)
SCT Support Level:                   1
Device State:                        SMART Off-line Data Collection executing in background (4)
Current Temperature:                    30 Celsius
Power Cycle Min/Max Temperature:     28/46 Celsius
Lifetime    Min/Max Temperature:     11/70 Celsius
Under/Over Temperature Limit Count:   0/0

SCT Temperature History Version:     2
Temperature Sampling Period:         1 minute
Temperature Logging Interval:        1 minute
Min/Max recommended Temperature:      0/60 Celsius
Min/Max Temperature Limit:           -40/70 Celsius
Temperature History Size (Index):    128 (64)

Index    Estimated Time   Temperature Celsius
  65    2018-07-28 10:06    31  ************
 ...    ..(126 skipped).    ..  ************
  64    2018-07-28 12:13    31  ************

SMART WRITE LOG does not return COUNT and LBA_LOW register
SCT (Get) Error Recovery Control command failed

Device Statistics (GP Log 0x04)
Page  Offset Size        Value Flags Description
0x01  =====  =               =  ===  == General Statistics (rev 1) ==
0x01  0x008  4             157  ---  Lifetime Power-On Resets
0x01  0x010  4           49023  ---  Power-on Hours
0x01  0x018  6    154994154345  ---  Logical Sectors Written
0x01  0x020  6       897377010  ---  Number of Write Commands
0x01  0x028  6    395957567089  ---  Logical Sectors Read
0x01  0x030  6      4680524246  ---  Number of Read Commands
0x03  =====  =               =  ===  == Rotating Media Statistics (rev 1) ==
0x03  0x008  4           48896  ---  Spindle Motor Power-on Hours
0x03  0x010  4           48896  ---  Head Flying Hours
0x03  0x018  4            2145  ---  Head Load Events
0x03  0x020  4               2  ---  Number of Reallocated Logical Sectors
0x03  0x028  4            4248  ---  Read Recovery Attempts
0x03  0x030  4               0  ---  Number of Mechanical Start Failures
0x04  =====  =               =  ===  == General Errors Statistics (rev 1) ==
0x04  0x008  4            3330  ---  Number of Reported Uncorrectable Errors
0x04  0x010  4             229  ---  Resets Between Cmd Acceptance and Completion
0x05  =====  =               =  ===  == Temperature Statistics (rev 1) ==
0x05  0x008  1              30  ---  Current Temperature
0x05  0x010  1              37  N--  Average Short Term Temperature
0x05  0x018  1              44  N--  Average Long Term Temperature
0x05  0x020  1              70  ---  Highest Temperature
0x05  0x028  1              11  ---  Lowest Temperature
0x05  0x030  1              66  N--  Highest Average Short Term Temperature
0x05  0x038  1              25  N--  Lowest Average Short Term Temperature
0x05  0x040  1              61  N--  Highest Average Long Term Temperature
0x05  0x048  1              25  N--  Lowest Average Long Term Temperature
0x05  0x050  4          341100  ---  Time in Over-Temperature
0x05  0x058  1              60  ---  Specified Maximum Operating Temperature
0x05  0x060  4               0  ---  Time in Under-Temperature
0x05  0x068  1               0  ---  Specified Minimum Operating Temperature
0x06  =====  =               =  ===  == Transport Statistics (rev 1) ==
0x06  0x008  4          159709  ---  Number of Hardware Resets
0x06  0x010  4           10116  ---  Number of ASR Events
0x06  0x018  4               3  ---  Number of Interface CRC Errors
                                |||_ C monitored condition met
                                ||__ D supports DSN
                                |___ N normalized value

Pending Defects log (GP Log 0x0c) not supported

SATA Phy Event Counters (GP Log 0x11)
ID      Size     Value  Description
0x0001  2            0  Command failed due to ICRC error
0x0002  2            0  R_ERR response for data FIS
0x0003  2            0  R_ERR response for device-to-host data FIS
0x0004  2            0  R_ERR response for host-to-device data FIS
0x0005  2            0  R_ERR response for non-data FIS
0x0006  2            0  R_ERR response for device-to-host non-data FIS
0x0007  2            0  R_ERR response for host-to-device non-data FIS
0x0009  2            9  Transition from drive PhyRdy to drive PhyNRdy
0x000a  2            8  Device-to-host register FISes sent due to a COMRESET
0x000b  2            0  CRC errors within host-to-device FIS
0x000d  2            0  Non-CRC errors within host-to-device FIS
