smartctl 7.2 2020-12-30 r5155 [x86_64-linux-5.13.19-4-pve] (local build)
Copyright (C) 2002-20, Bruce Allen, Christian Franke, www.smartmontools.org

=== START OF INFORMATION SECTION ===
Device Model:     INTEL SSDSC2BA800G3E
Firmware Version: 5DV10250
User Capacity:    800,166,076,416 bytes [800 GB]
Sector Size:      512 bytes logical/physical
Rotation Rate:    Solid State Device
Form Factor:      2.5 inches
TRIM Command:     Available, deterministic, zeroed
Device is:        Not in smartctl database [for details use: -P showall]
ATA Version is:   ATA8-ACS T13/1699-D revision 4
SATA Version is:  SATA 2.6, 6.0 Gb/s (current: 6.0 Gb/s)
Local Time is:    Thu Sep  8 19:19:43 2022 EDT
SMART support is: Available - device has SMART capability.
SMART support is: Enabled
AAM feature is:   Unavailable
APM feature is:   Unavailable
Rd look-ahead is: Enabled
Write cache is:   Disabled
DSN feature is:   Unavailable
ATA Security is:  Disabled, NOT FROZEN [SEC1]
Wt Cache Reorder: Enabled

=== START OF READ SMART DATA SECTION ===
SMART overall-health self-assessment test result: FAILED!
Drive failure expected in less than 24 hours. SAVE ALL DATA.
See vendor-specific Attribute list for failed Attributes.

General SMART Values:
Offline data collection status:  (0x03) Offline data collection activity
                                        is in progress.
                                        Auto Offline Data Collection: Disabled.
Self-test execution status:      (  64) The previous self-test completed having
                                        a test element that failed and the test
                                        element that failed is not known.
Total time to complete Offline 
data collection:                (    2) seconds.
Offline data collection
capabilities:                    (0x79) SMART execute Offline immediate.
                                        No Auto Offline data collection support.
                                        Suspend Offline collection upon new
                                        command.
                                        Offline surface scan supported.
                                        Self-test supported.
                                        Conveyance Self-test supported.
                                        Selective Self-test supported.
SMART capabilities:            (0x0003) Saves SMART data before entering
                                        power-saving mode.
                                        Supports SMART auto save timer.
Error logging capability:        (0x01) Error logging supported.
                                        General Purpose Logging supported.
Short self-test routine 
recommended polling time:        (   1) minutes.
Extended self-test routine
recommended polling time:        (   2) minutes.
Conveyance self-test routine
recommended polling time:        (   2) minutes.
SCT capabilities:              (0x003d) SCT Status supported.
                                        SCT Error Recovery Control supported.
                                        SCT Feature Control supported.
                                        SCT Data Table supported.

SMART Attributes Data Structure revision number: 1
Vendor Specific SMART Attributes with Thresholds:
ID# ATTRIBUTE_NAME          FLAGS    VALUE WORST THRESH FAIL RAW_VALUE
  5 Reallocated_Sector_Ct   -O--CK   100   100   000    -    0
  9 Power_On_Hours          -O--CK   100   100   000    -    48594
 12 Power_Cycle_Count       -O--CK   100   100   000    -    47
170 Unknown_Attribute       PO--CK   100   100   010    -    0
171 Unknown_Attribute       -O--CK   100   100   000    -    0
172 Unknown_Attribute       -O--CK   100   100   000    -    0
174 Unknown_Attribute       -O--CK   100   100   000    -    40
175 Program_Fail_Count_Chip PO--CK   001   001   010    NOW  1215479152641
183 Runtime_Bad_Block       -O--CK   100   100   000    -    0
184 End-to-End_Error        PO--CK   100   100   090    -    0
187 Reported_Uncorrect      -O--CK   100   100   000    -    0
190 Airflow_Temperature_Cel -O---K   079   059   000    -    21 (Min/Max 15/42)
192 Power-Off_Retract_Count -O--CK   100   100   000    -    40
194 Temperature_Celsius     -O---K   100   100   000    -    21
197 Current_Pending_Sector  -O--CK   100   100   000    -    0
199 UDMA_CRC_Error_Count    -OSRCK   100   100   000    -    0
225 Unknown_SSD_Attribute   -O--CK   100   100   000    -    7674172
226 Unknown_SSD_Attribute   -O--CK   100   100   000    -    0
227 Unknown_SSD_Attribute   -O--CK   100   100   000    -    66
228 Power-off_Retract_Count -O--CK   100   100   000    -    972
232 Available_Reservd_Space PO--CK   100   100   010    -    0
233 Media_Wearout_Indicator -O--CK   099   099   000    -    0
234 Unknown_Attribute       -O--CK   100   100   000    -    0
241 Total_LBAs_Written      -O--CK   100   100   000    -    7674172
242 Total_LBAs_Read         -O--CK   100   100   000    -    7239903
                            ||||||_ K auto-keep
                            |||||__ C event count
                            ||||___ R error rate
                            |||____ S speed/performance
                            ||_____ O updated online
                            |______ P prefailure warning

General Purpose Log Directory Version 1
SMART           Log Directory Version 1 [multi-sector log support]
Address    Access  R/W   Size  Description
0x00       GPL,SL  R/O      1  Log Directory
0x01       GPL,SL  R/O      1  Summary SMART error log
0x02       GPL,SL  R/O      8  Comprehensive SMART error log
0x03       GPL,SL  R/O     20  Ext. Comprehensive SMART error log
0x04       GPL,SL  R/O      8  Device Statistics log
0x06       GPL,SL  R/O      1  SMART self-test log
0x07       GPL,SL  R/O      2  Extended self-test log
0x09       GPL,SL  R/W      1  Selective self-test log
0x10       GPL,SL  R/O      1  NCQ Command Error log
0x11       GPL,SL  R/O      1  SATA Phy Event Counters log
0x80-0x9f  GPL,SL  R/W     16  Host vendor specific log
0xb0       GPL,SL  VS       1  Device vendor specific log
0xb1       GPL,SL  VS      33  Device vendor specific log
0xd0       GPL     VS    1152  Device vendor specific log
0xd0       SL      VS     128  Device vendor specific log
0xd1       GPL     VS   13056  Device vendor specific log
0xe0       GPL,SL  R/W      1  SCT Command/Status
0xe1       GPL,SL  R/W      1  SCT Data Transfer

SMART Extended Comprehensive Error Log Version: 1 (20 sectors)
No Errors Logged

SMART Extended Self-test Log Version: 1 (2 sectors)
Num  Test_Description    Status                  Remaining  LifeTime(hours)  LBA_of_first_error
# 1  Short offline       Completed: unknown failure    00%     48594         0
# 2  Short offline       Completed without error       00%         3         -
# 3  Extended offline    Completed without error       00%         1         -
# 4  Short offline       Completed without error       00%         1         -

SMART Selective self-test log data structure revision number 1
 SPAN  MIN_LBA  MAX_LBA  CURRENT_TEST_STATUS
    1        0        0  Not_testing
    2        0        0  Not_testing
    3        0        0  Not_testing
    4        0        0  Not_testing
    5        0        0  Not_testing
Selective self-test flags (0x0):
  After scanning selected spans, do NOT read-scan remainder of disk.
If Selective self-test is pending on power-up, resume after 0 minute delay.

SCT Status Version:                  3
SCT Version (vendor specific):       1 (0x0001)
Device State:                        Active (0)
Current Temperature:                    21 Celsius
Power Cycle Min/Max Temperature:     15/42 Celsius
Lifetime    Min/Max Temperature:      1/42 Celsius
Under/Over Temperature Limit Count:   0/0

SCT Temperature History Version:     2
Temperature Sampling Period:         1 minute
Temperature Logging Interval:        1 minute
Min/Max recommended Temperature:      0/70 Celsius
Min/Max Temperature Limit:            0/70 Celsius
Temperature History Size (Index):    478 (440)

Index    Estimated Time   Temperature Celsius
 441    2022-09-08 11:22    21  **
 ...    ..(423 skipped).    ..  **
 387    2022-09-08 18:26    21  **
 388    2022-09-08 18:27     ?  -
 389    2022-09-08 18:28    17  -
 390    2022-09-08 18:29    18  -
 391    2022-09-08 18:30    19  -
 ...    ..(  3 skipped).    ..  -
 395    2022-09-08 18:34    19  -
 396    2022-09-08 18:35    21  **
 397    2022-09-08 18:36    27  ********
 398    2022-09-08 18:37    31  ************
 399    2022-09-08 18:38    33  **************
 400    2022-09-08 18:39    35  ****************
 401    2022-09-08 18:40    36  *****************
 402    2022-09-08 18:41    37  ******************
 403    2022-09-08 18:42    38  *******************
 404    2022-09-08 18:43    39  ********************
 405    2022-09-08 18:44    40  *********************
 406    2022-09-08 18:45    40  *********************
 407    2022-09-08 18:46    40  *********************
 408    2022-09-08 18:47    41  **********************
 409    2022-09-08 18:48    41  **********************
 410    2022-09-08 18:49    41  **********************
 411    2022-09-08 18:50    42  ***********************
 412    2022-09-08 18:51    42  ***********************
 413    2022-09-08 18:52    41  **********************
 414    2022-09-08 18:53    42  ***********************
 415    2022-09-08 18:54    41  **********************
 416    2022-09-08 18:55    42  ***********************
 417    2022-09-08 18:56    42  ***********************
 418    2022-09-08 18:57    39  ********************
 419    2022-09-08 18:58    37  ******************
 420    2022-09-08 18:59    35  ****************
 421    2022-09-08 19:00    34  ***************
 422    2022-09-08 19:01    33  **************
 423    2022-09-08 19:02    33  **************
 424    2022-09-08 19:03    32  *************
 425    2022-09-08 19:04    32  *************
 426    2022-09-08 19:05    31  ************
 427    2022-09-08 19:06    31  ************
 428    2022-09-08 19:07    30  ***********
 429    2022-09-08 19:08    27  ********
 430    2022-09-08 19:09    25  ******
 431    2022-09-08 19:10    24  *****
 432    2022-09-08 19:11    23  ****
 433    2022-09-08 19:12    23  ****
 434    2022-09-08 19:13    22  ***
 435    2022-09-08 19:14    22  ***
 436    2022-09-08 19:15    21  **
 ...    ..(  3 skipped).    ..  **
 440    2022-09-08 19:19    21  **

SCT Error Recovery Control:
           Read: Disabled
          Write: Disabled

Device Statistics (GP Log 0x04)
Page  Offset Size        Value Flags Description
0x01  =====  =               =  ===  == General Statistics (rev 2) ==
0x01  0x008  4              47  ---  Lifetime Power-On Resets
0x01  0x018  6    502934582902  ---  Logical Sectors Written
0x01  0x020  6         3626219  ---  Number of Write Commands
0x01  0x028  6    474474283478  ---  Logical Sectors Read
0x01  0x030  6         2465100  ---  Number of Read Commands
0x04  =====  =               =  ===  == General Errors Statistics (rev 1) ==
0x04  0x008  4               0  ---  Number of Reported Uncorrectable Errors
0x04  0x010  4               0  ---  Resets Between Cmd Acceptance and Completion
0x05  =====  =               =  ===  == Temperature Statistics (rev 1) ==
0x05  0x008  1              21  ---  Current Temperature
0x05  0x010  1              18  ---  Average Short Term Temperature
0x05  0x018  1               4  ---  Average Long Term Temperature
0x05  0x020  1              41  ---  Highest Temperature
0x05  0x028  1               2  ---  Lowest Temperature
0x05  0x030  1              18  ---  Highest Average Short Term Temperature
0x05  0x038  1               3  ---  Lowest Average Short Term Temperature
0x05  0x040  1               8  ---  Highest Average Long Term Temperature
0x05  0x048  1               3  ---  Lowest Average Long Term Temperature
0x05  0x050  4               0  ---  Time in Over-Temperature
0x05  0x058  1               0  ---  Specified Maximum Operating Temperature
0x05  0x060  4               0  ---  Time in Under-Temperature
0x05  0x068  1              70  ---  Specified Minimum Operating Temperature
0x06  =====  =               =  ===  == Transport Statistics (rev 1) ==
0x06  0x008  4             206  ---  Number of Hardware Resets
0x06  0x010  4               6  ---  Number of ASR Events
0x06  0x018  4               0  ---  Number of Interface CRC Errors
0x07  =====  =               =  ===  == Solid State Device Statistics (rev 1) ==
0x07  0x008  1               1  ---  Percentage Used Endurance Indicator
                                |||_ C monitored condition met
                                ||__ D supports DSN
                                |___ N normalized value

Pending Defects log (GP Log 0x0c) not supported

SATA Phy Event Counters (GP Log 0x11)
ID      Size     Value  Description
0x0001  4            0  Command failed due to ICRC error
0x0003  4            0  R_ERR response for device-to-host data FIS
0x0004  4            0  R_ERR response for host-to-device data FIS
0x0006  4            0  R_ERR response for device-to-host non-data FIS
0x000a  4            2  Device-to-host register FISes sent due to a COMRESET
0x000b  4            0  CRC errors within host-to-device FIS
0x000d  4            0  Non-CRC errors within host-to-device FIS

