smartctl 6.6 2017-11-05 r4594 [x86_64-linux-4.19.0-8-amd64] (local build)
Copyright (C) 2002-17, Bruce Allen, Christian Franke, www.smartmontools.org

=== START OF INFORMATION SECTION ===
Device Model:     Samsung SSD 850 PRO 2TB
Serial Number:    S2KMNCAGB01383M
LU WWN Device Id: 5 002538 c7000f67a
Firmware Version: EXM02B6Q
User Capacity:    2,048,408,248,320 bytes [2.04 TB]
Sector Size:      512 bytes logical/physical
Rotation Rate:    Solid State Device
Device is:        Not in smartctl database [for details use: -P showall]
ATA Version is:   ACS-2, ATA8-ACS T13/1699-D revision 4c
SATA Version is:  SATA 3.1, 6.0 Gb/s (current: 6.0 Gb/s)
Local Time is:    Fri Apr 10 14:12:22 2020 EEST
SMART support is: Available - device has SMART capability.
SMART support is: Enabled
AAM feature is:   Unavailable
APM feature is:   Unavailable
Rd look-ahead is: Enabled
Write cache is:   Enabled
DSN feature is:   Unavailable
ATA Security is:  Disabled, NOT FROZEN [SEC1]
Wt Cache Reorder: Enabled

=== START OF READ SMART DATA SECTION ===
SMART overall-health self-assessment test result: PASSED

General SMART Values:
Offline data collection status:  (0x00)	Offline data collection activity
					was never started.
					Auto Offline Data Collection: Disabled.
Self-test execution status:      (   0)	The previous self-test routine completed
					without error or no self-test has ever 
					been run.
Total time to complete Offline 
data collection: 		(    0) seconds.
Offline data collection
capabilities: 			 (0x53) SMART execute Offline immediate.
					Auto Offline data collection on/off support.
					Suspend Offline collection upon new
					command.
					No Offline surface scan supported.
					Self-test supported.
					No Conveyance Self-test supported.
					Selective Self-test supported.
SMART capabilities:            (0x0003)	Saves SMART data before entering
					power-saving mode.
					Supports SMART auto save timer.
Error logging capability:        (0x01)	Error logging supported.
					General Purpose Logging supported.
Short self-test routine 
recommended polling time: 	 (   2) minutes.
Extended self-test routine
recommended polling time: 	 ( 600) minutes.
SCT capabilities: 	       (0x003d)	SCT Status supported.
					SCT Error Recovery Control supported.
					SCT Feature Control supported.
					SCT Data Table supported.

SMART Attributes Data Structure revision number: 1
Vendor Specific SMART Attributes with Thresholds:
ID# ATTRIBUTE_NAME          FLAGS    VALUE WORST THRESH FAIL RAW_VALUE
  5 Reallocated_Sector_Ct   PO--CK   099   099   010    -    101
  9 Power_On_Hours          -O--CK   092   092   000    -    36022
 12 Power_Cycle_Count       -O--CK   099   099   000    -    129
177 Wear_Leveling_Count     PO--C-   099   099   000    -    17
179 Used_Rsvd_Blk_Cnt_Tot   PO--C-   099   099   010    -    101
181 Program_Fail_Cnt_Total  -O--CK   100   100   010    -    0
182 Erase_Fail_Count_Total  -O--CK   100   100   010    -    0
183 Runtime_Bad_Block       PO--C-   099   099   010    -    101
187 Reported_Uncorrect      -O--CK   085   085   000    -    148592
190 Airflow_Temperature_Cel -O--CK   077   063   000    -    23
195 Hardware_ECC_Recovered  -O-RC-   001   001   000    -    148592
199 UDMA_CRC_Error_Count    -OSRCK   100   100   000    -    0
235 Unknown_Attribute       -O--C-   099   099   000    -    61
241 Total_LBAs_Written      -O--CK   099   099   000    -    29619424584
                            ||||||_ K auto-keep
                            |||||__ C event count
                            ||||___ R error rate
                            |||____ S speed/performance
                            ||_____ O updated online
                            |______ P prefailure warning

General Purpose Log Directory Version 1
SMART           Log Directory Version 1 [multi-sector log support]
Address    Access  R/W   Size  Description
0x00       GPL,SL  R/O      1  Log Directory
0x01           SL  R/O      1  Summary SMART error log
0x02           SL  R/O      1  Comprehensive SMART error log
0x03       GPL     R/O      1  Ext. Comprehensive SMART error log
0x06           SL  R/O      1  SMART self-test log
0x07       GPL     R/O      1  Extended self-test log
0x09           SL  R/W      1  Selective self-test log
0x10       GPL     R/O      1  NCQ Command Error log
0x11       GPL     R/O      1  SATA Phy Event Counters log
0x13       GPL     R/O      1  SATA NCQ Send and Receive log
0x30       GPL,SL  R/O      9  IDENTIFY DEVICE data log
0x80-0x9f  GPL,SL  R/W     16  Host vendor specific log
0xa1           SL  VS      16  Device vendor specific log
0xa5           SL  VS      16  Device vendor specific log
0xce           SL  VS      16  Device vendor specific log
0xe0       GPL,SL  R/W      1  SCT Command/Status
0xe1       GPL,SL  R/W      1  SCT Data Transfer

SMART Extended Comprehensive Error Log Version: 1 (1 sectors)
Device Error Count: 65535 (device log contains only the most recent 4 errors)
	CR     = Command Register
	FEATR  = Features Register
	COUNT  = Count (was: Sector Count) Register
	LBA_48 = Upper bytes of LBA High/Mid/Low Registers ]  ATA-8
	LH     = LBA High (was: Cylinder High) Register    ]   LBA
	LM     = LBA Mid (was: Cylinder Low) Register      ] Register
	LL     = LBA Low (was: Sector Number) Register     ]
	DV     = Device (was: Device/Head) Register
	DC     = Device Control Register
	ER     = Error register
	ST     = Status register
Powered_Up_Time is measured from power on, and printed as
DDd+hh:mm:SS.sss where DD=days, hh=hours, mm=minutes,
SS=sec, and sss=millisec. It "wraps" after 49.710 days.

Error 65535 [1] occurred at disk power-on lifetime: 36022 hours (1500 days + 22 hours)
  When the command that caused the error occurred, the device was active or idle.

  After command completion occurred, registers were:
  ER -- ST COUNT  LBA_48  LH LM LL DV DC
  -- -- -- == -- == == == -- -- -- -- --
  00 -- 51 00 01 00 00 00 00 00 10 00 00  Error:  at LBA = 0x00000010 = 16

  Commands leading to the command that caused the error were:
  CR FEATR COUNT  LBA_48  LH LM LL DV DC  Powered_Up_Time  Command/Feature_Name
  -- == -- == -- == == == -- -- -- -- --  ---------------  --------------------
  60 00 08 00 00 00 00 4b 30 ee 7a 00 00     23:58:22.000  READ FPDMA QUEUED
  60 00 08 00 70 00 00 3b 5b c1 ca 00 0e     23:58:22.000  READ FPDMA QUEUED
  60 00 08 00 68 00 00 17 da 63 ea 00 0d     23:58:22.000  READ FPDMA QUEUED
  60 00 08 00 60 00 00 11 18 39 22 00 0c     23:58:22.000  READ FPDMA QUEUED
  60 00 08 00 58 00 00 21 96 ab 12 00 0b     23:58:22.000  READ FPDMA QUEUED

Error 65534 [0] occurred at disk power-on lifetime: 36022 hours (1500 days + 22 hours)
  When the command that caused the error occurred, the device was active or idle.

  After command completion occurred, registers were:
  ER -- ST COUNT  LBA_48  LH LM LL DV DC
  -- -- -- == -- == == == -- -- -- -- --
  00 -- 51 00 01 00 00 00 00 00 10 00 00  Error:  at LBA = 0x00000010 = 16

  Commands leading to the command that caused the error were:
  CR FEATR COUNT  LBA_48  LH LM LL DV DC  Powered_Up_Time  Command/Feature_Name
  -- == -- == -- == == == -- -- -- -- --  ---------------  --------------------
  60 00 08 00 78 00 00 9f 77 42 92 00 0f     23:58:22.000  READ FPDMA QUEUED
  60 00 08 00 70 00 00 e1 51 0a 92 00 0e     23:58:22.000  READ FPDMA QUEUED
  60 00 08 00 60 00 00 11 18 39 12 00 0c     23:58:22.000  READ FPDMA QUEUED
  60 00 08 00 58 00 00 3b 5b c1 ba 00 0b     23:58:22.000  READ FPDMA QUEUED
  60 00 08 00 50 00 00 3b 52 2f 72 00 0a     23:58:22.000  READ FPDMA QUEUED

Error 65533 [3] occurred at disk power-on lifetime: 36022 hours (1500 days + 22 hours)
  When the command that caused the error occurred, the device was active or idle.

  After command completion occurred, registers were:
  ER -- ST COUNT  LBA_48  LH LM LL DV DC
  -- -- -- == -- == == == -- -- -- -- --
  00 -- 51 00 01 00 00 00 00 00 10 00 00  Error:  at LBA = 0x00000010 = 16

  Commands leading to the command that caused the error were:
  CR FEATR COUNT  LBA_48  LH LM LL DV DC  Powered_Up_Time  Command/Feature_Name
  -- == -- == -- == == == -- -- -- -- --  ---------------  --------------------
  60 00 08 00 00 00 00 3b 52 2f 52 00 00     23:58:21.000  READ FPDMA QUEUED
  60 00 08 00 70 00 00 17 da 63 c2 00 0e     23:58:21.000  READ FPDMA QUEUED
  60 00 08 00 68 00 00 3b 5b c1 a2 00 0d     23:58:21.000  READ FPDMA QUEUED
  60 00 08 00 60 00 00 9f 77 42 7a 00 0c     23:58:21.000  READ FPDMA QUEUED
  60 00 08 00 58 00 00 10 e3 44 e2 00 0b     23:58:21.000  READ FPDMA QUEUED

Error 65532 [2] occurred at disk power-on lifetime: 36022 hours (1500 days + 22 hours)
  When the command that caused the error occurred, the device was active or idle.

  After command completion occurred, registers were:
  ER -- ST COUNT  LBA_48  LH LM LL DV DC
  -- -- -- == -- == == == -- -- -- -- --
  00 -- 51 00 01 00 00 00 00 00 10 00 00  Error:  at LBA = 0x00000010 = 16

  Commands leading to the command that caused the error were:
  CR FEATR COUNT  LBA_48  LH LM LL DV DC  Powered_Up_Time  Command/Feature_Name
  -- == -- == -- == == == -- -- -- -- --  ---------------  --------------------
  60 00 08 00 68 00 00 ca bc e8 c2 00 0d     23:58:21.000  READ FPDMA QUEUED
  60 00 08 00 60 00 00 4b 30 ee 42 00 0c     23:58:21.000  READ FPDMA QUEUED
  60 00 08 00 58 00 00 17 da 63 b2 00 0b     23:58:21.000  READ FPDMA QUEUED
  60 00 08 00 50 00 00 21 96 aa da 00 0a     23:58:21.000  READ FPDMA QUEUED
  60 00 08 00 48 00 00 3b 54 10 6a 00 09     23:58:21.000  READ FPDMA QUEUED

SMART Extended Self-test Log Version: 1 (1 sectors)
Num  Test_Description    Status                  Remaining  LifeTime(hours)  LBA_of_first_error
# 1  Short offline       Completed without error       00%     36022         -
# 2  Extended offline    Completed: read failure       90%     36022         294710600
# 3  Extended offline    Completed: read failure       90%     36022         294710600
# 4  Extended offline    Completed: read failure       90%     36019         294710600
# 5  Extended offline    Completed: read failure       90%     35999         294710600

SMART Selective self-test log data structure revision number 1
 SPAN  MIN_LBA  MAX_LBA  CURRENT_TEST_STATUS
    1        0        0  Not_testing
    2        0        0  Not_testing
    3        0        0  Not_testing
    4        0        0  Not_testing
    5        0        0  Not_testing
  255        0    65535  Read_scanning was never started
Selective self-test flags (0x0):
  After scanning selected spans, do NOT read-scan remainder of disk.
If Selective self-test is pending on power-up, resume after 0 minute delay.

SCT Status Version:                  3
SCT Version (vendor specific):       256 (0x0100)
SCT Support Level:                   1
Device State:                        SCT command executing in background (5)
Current Temperature:                    23 Celsius
Power Cycle Min/Max Temperature:     22/36 Celsius
Lifetime    Min/Max Temperature:      0/70 Celsius
Under/Over Temperature Limit Count:  560110704/3893493760
SMART Status:                        0xd41b (Reserved)

SCT Temperature History Version:     3 (Unknown, should be 2)
Temperature Sampling Period:         1 minute
Temperature Logging Interval:        10 minutes
Min/Max recommended Temperature:      0/70 Celsius
Min/Max Temperature Limit:            0/70 Celsius
Temperature History Size (Index):    128 (21)

Index    Estimated Time   Temperature Celsius
  22    2020-04-09 17:00    31  ************
  23    2020-04-09 17:10    34  ***************
  24    2020-04-09 17:20    34  ***************
  25    2020-04-09 17:30    28  *********
  26    2020-04-09 17:40    27  ********
  27    2020-04-09 17:50    28  *********
 ...    ..(  6 skipped).    ..  *********
  34    2020-04-09 19:00    28  *********
  35    2020-04-09 19:10    27  ********
  36    2020-04-09 19:20    29  **********
  37    2020-04-09 19:30    28  *********
  38    2020-04-09 19:40    28  *********
  39    2020-04-09 19:50    27  ********
  40    2020-04-09 20:00    28  *********
 ...    ..(  2 skipped).    ..  *********
  43    2020-04-09 20:30    28  *********
  44    2020-04-09 20:40    29  **********
  45    2020-04-09 20:50    27  ********
  46    2020-04-09 21:00    31  ************
  47    2020-04-09 21:10    29  **********
  48    2020-04-09 21:20    28  *********
  49    2020-04-09 21:30    28  *********
  50    2020-04-09 21:40    29  **********
  51    2020-04-09 21:50    28  *********
  52    2020-04-09 22:00    29  **********
  53    2020-04-09 22:10    27  ********
  54    2020-04-09 22:20    28  *********
  55    2020-04-09 22:30    28  *********
  56    2020-04-09 22:40    30  ***********
  57    2020-04-09 22:50    30  ***********
  58    2020-04-09 23:00    29  **********
  59    2020-04-09 23:10    28  *********
  60    2020-04-09 23:20    29  **********
  61    2020-04-09 23:30    27  ********
  62    2020-04-09 23:40    28  *********
  63    2020-04-09 23:50    28  *********
  64    2020-04-10 00:00    28  *********
  65    2020-04-10 00:10    27  ********
  66    2020-04-10 00:20    28  *********
  67    2020-04-10 00:30    28  *********
  68    2020-04-10 00:40    28  *********
  69    2020-04-10 00:50    27  ********
 ...    ..(  2 skipped).    ..  ********
  72    2020-04-10 01:20    27  ********
  73    2020-04-10 01:30    28  *********
  74    2020-04-10 01:40    27  ********
 ...    ..(  2 skipped).    ..  ********
  77    2020-04-10 02:10    27  ********
  78    2020-04-10 02:20    28  *********
  79    2020-04-10 02:30    27  ********
  80    2020-04-10 02:40    28  *********
  81    2020-04-10 02:50    28  *********
  82    2020-04-10 03:00    27  ********
  83    2020-04-10 03:10    28  *********
  84    2020-04-10 03:20    26  *******
  85    2020-04-10 03:30    28  *********
  86    2020-04-10 03:40    27  ********
  87    2020-04-10 03:50    27  ********
  88    2020-04-10 04:00    27  ********
  89    2020-04-10 04:10    26  *******
  90    2020-04-10 04:20    27  ********
  91    2020-04-10 04:30    27  ********
  92    2020-04-10 04:40    27  ********
  93    2020-04-10 04:50    26  *******
  94    2020-04-10 05:00    26  *******
  95    2020-04-10 05:10    27  ********
  96    2020-04-10 05:20    26  *******
  97    2020-04-10 05:30    25  ******
  98    2020-04-10 05:40    27  ********
  99    2020-04-10 05:50    27  ********
 100    2020-04-10 06:00    26  *******
 101    2020-04-10 06:10    26  *******
 102    2020-04-10 06:20    26  *******
 103    2020-04-10 06:30    27  ********
 104    2020-04-10 06:40    28  *********
 105    2020-04-10 06:50    26  *******
 106    2020-04-10 07:00    27  ********
 107    2020-04-10 07:10    26  *******
 ...    ..(  2 skipped).    ..  *******
 110    2020-04-10 07:40    26  *******
 111    2020-04-10 07:50    27  ********
 112    2020-04-10 08:00    28  *********
 113    2020-04-10 08:10    27  ********
 114    2020-04-10 08:20    28  *********
 115    2020-04-10 08:30    27  ********
 116    2020-04-10 08:40    28  *********
 117    2020-04-10 08:50    27  ********
 ...    ..(  2 skipped).    ..  ********
 120    2020-04-10 09:20    27  ********
 121    2020-04-10 09:30    28  *********
 122    2020-04-10 09:40    27  ********
 123    2020-04-10 09:50    28  *********
 124    2020-04-10 10:00    28  *********
 125    2020-04-10 10:10    28  *********
 126    2020-04-10 10:20    27  ********
 127    2020-04-10 10:30    28  *********
   0    2020-04-10 10:40    27  ********
   1    2020-04-10 10:50    27  ********
   2    2020-04-10 11:00    28  *********
   3    2020-04-10 11:10    35  ****************
   4    2020-04-10 11:20    28  *********
   5    2020-04-10 11:30    28  *********
   6    2020-04-10 11:40    36  *****************
   7    2020-04-10 11:50    27  ********
   8    2020-04-10 12:00    27  ********
   9    2020-04-10 12:10    28  *********
  10    2020-04-10 12:20    36  *****************
  11    2020-04-10 12:30    29  **********
  12    2020-04-10 12:40    27  ********
  13    2020-04-10 12:50    27  ********
  14    2020-04-10 13:00    28  *********
  15    2020-04-10 13:10    28  *********
  16    2020-04-10 13:20    28  *********
  17    2020-04-10 13:30    34  ***************
  18    2020-04-10 13:40    28  *********
  19    2020-04-10 13:50    31  ************
  20    2020-04-10 14:00    23  ****
  21    2020-04-10 14:10    23  ****

SCT Error Recovery Control:
           Read: Disabled
          Write: Disabled

Device Statistics (GP/SMART Log 0x04) not supported

Pending Defects log (GP Log 0x0c) not supported

SATA Phy Event Counters (GP Log 0x11)
ID      Size     Value  Description
0x0001  2            0  Command failed due to ICRC error
0x0002  2            0  R_ERR response for data FIS
0x0003  2            0  R_ERR response for device-to-host data FIS
0x0004  2            0  R_ERR response for host-to-device data FIS
0x0005  2            0  R_ERR response for non-data FIS
0x0006  2            0  R_ERR response for device-to-host non-data FIS
0x0007  2            0  R_ERR response for host-to-device non-data FIS
0x0008  2            0  Device-to-host non-data FIS retries
0x0009  2            7  Transition from drive PhyRdy to drive PhyNRdy
0x000a  2            7  Device-to-host register FISes sent due to a COMRESET
0x000b  2            0  CRC errors within host-to-device FIS
0x000d  2            0  Non-CRC errors within host-to-device FIS
0x000f  2            0  R_ERR response for host-to-device data FIS, CRC
0x0010  2            0  R_ERR response for host-to-device data FIS, non-CRC
0x0012  2            0  R_ERR response for host-to-device non-data FIS, CRC
0x0013  2            0  R_ERR response for host-to-device non-data FIS, non-CRC

